tconst,primaryTitle,originalTitle,isAdult,startYear,runtimeMinutes,genres,averageRating,numVotes,directors,synopsis
tt11710090,Nussa: The Movie,Nussa: The Movie,0,2021.0,107,"Adventure,Animation,Comedy",7.9,495.0,Bony Wirasmono,Nussa's life changed when he met a new friend who was much more liked by his friends than himself.
tt9267624,The Pacifist,The Pacifist,0,2018.0,57,"Biography,Documentary",7.5,31.0,Alex Zhort,"On April 18th, 2017, Larry Bassett refused to pay federal income taxes on over $1 Million, becoming the top tax resister in US history. In his defiance, he wrote letters to U.S. government agencies and representatives, announcing that his conscience will not allow him to pay for the US war machine. He knows that breaking the law will bring retribution from the government, and he accepts the consequences of his actions. In fact, he's begging for their retaliation as his family and neighbors worry about his safety. Larry is retired now and lives alone with his extensive art collection in a loft downtown. He spends his days provoking the government with emails and phone calls, desperately trying to arouse a response from the IRS. In order to live by his personal motto that you are what you pay for he redirects his inherited wealth to individuals, causes and charities around the world. This is the remarkable story of his mission to carry on the legacy of his peace activist parents by taking a stand against war through civil disobedience."
tt4668742,Welcome Zindagi,Welcome Zindagi,0,2015.0,135,"Comedy,Drama",8.1,78.0,Umesh Ghadge,"Welcome Zindagi is a dark comedy about a girl who wants to end it all, and a boy who will change her perception of life."
tt0299977,Hero,Ying xiong,0,2002.0,120,"Action,Adventure,Drama",7.9,181559.0,Yimou Zhang,"The movie opens with a brief history saying that China was once divided into seven kingdoms that warred with each other constantly. It took one man to conquer all the kingdoms and unite the land into what is now China. The opening captions also introduce the theme of the movie: people die for all sorts of reasons, for friendship, for love, for an ideal...and people kill for these same reasons also.A nameless man (Jet Li) is brought to meet the king of Qin (Daoming Chen) in his palace. Nameless is stripped naked, searched for weapons, and informed that he must remain 100 paces from the king at all times or he will be killed immediately.It is announced that Nameless is being honored for killing three assassins from the kingdom of Zhao. These assassins are named Sky (Donnie Yen), Flying Snow (Maggie Cheung), and Broken Sword (Tony Chiu-Wai Leung). Nameless says he is a minor law-enforcement officer from Qin and presents a silver spearhead, which is recognized as the weapon of Sky. Nameless claims he killed Sky in a one-on-one duel. The king is amazed because Sky was such a lethal fighter. The king sets aside the spear and orders the official reward to be granted: a lot of gold, a lot of land, and the right to approach within 20 paces of the king to have a drink with him. The king asks Nameless to explain how he defeated Sky.We flashback to a chess hall where royal guards from Qin attempt to arrest Sky. Sky beats them all, mangling their swords and telling them to go away. As he is about to walk out, Nameless appears and announces he is there to arrest Sky. Sky does not believe him, feeling confident from his recent victory. The two have a fight (which is extremely fast and amazing to watch!) and find that they are evenly matched. Nameless pays a blind man to play music while they fight. While the music is playing, Sky and Nameless imagine the fight in their minds. This goes on until the strings on the harp-like instrument break and the two fighters open their eyes back to reality. Nameless launches into Sky fast enough to cut through Sky's spear and stab him. The royal guards witness all of this.Back in the present, Nameless presents two swords to the king: the weapons of Flying Snow and Broken Sword. The king declares that Flying Snow and Broken Sword tried to kill him 3 years ago. They hacked their way through entire armies of his men to get to him--but their attempt failed and they escaped. Since then, the king has kept all people 100 paces away from him and he has never taken off his armor or known a single night of peaceful sleep. With the proof of their deaths in front of him, the king orders the official reward for Nameless.For killing Broken Sword and Flying Snow, Nameless is rewarded with more gold, more lands, and the right to approach within 10 paces of the king to have a drink with him. The king asks how Nameless killed the assassins. Nameless explains that the two were lovers but the couple had a falling out 3 years ago. Nameless says he used their troubled relationship to drive them apart.In a flashback to a calligraphy school in the land of Zhao, everyone wears red. Broken Sword is a calligraphy master. Flying Snow is in the scene as well. Also at the school is a young woman named Moon (Ziyi Zhang), Broken Sword's servant. Nameless hires Broken Sword to draw a scroll eight feet tall and four feet wide with a single character on it: the Chinese word for sword. But Nameless explains that (due to the complexities of Chinese written language) there are 19 ways to write the word sword. Nameless asks for the 20th variation.We cut briefly back to the king, who is perturbed that the languages have gotten so complex. He proclaims that his ideal is to unite the lands and people as one country and establish a single written language. Nameless explains that sword play is much like calligraphy and he knew if he could have an example of Broken Sword's calligraphy, he would learn the secret to defeating his sword-fighting ability. The scroll is revealed and displayed behind the king. The king looks at it and asks Nameless to continue.At the calligraphy school, while Broken Sword is working on the scroll, the archers of Qin attack. This is a visually spectacular scene as millions of arrows are fired at the school. Flying Snow and Nameless look at each other and decide to stop the arrows, which are piercing the walls and killing students. Flying Snow and Nameless leap on to the roof and deflect the rain of arrows to save the school. Though many have already died, they stop any further arrows from harming anyone. The legendary archers of Qin retreat and make camp, preparing to attack again in the morning.Nameless reveals to Broken Sword and Flying Snow that he is a soldier of Qin and challenges them both to a duel. He takes the scroll that he has paid for and says if they accept his challenge to meet him at the army encampment the next day. That night Nameless meditates on the scroll. Broken Sword (knowing the scroll will reveal his weakness to Nameless) makes love to Moon (knowing that Flying Snow is watching) and is killed by Flying Snow for his betrayal. Moon tries to avenge her master but is killed by Flying Snow in another beautifully colorful fight scene amongst a shower of yellow leaves. The next day at the army camp, Nameless tells the soldiers to back off so he can have his fight with Flying Snow. Nameless and Flying Snow fight, but she is so emotionally distraught by all that has happened that he easily wins. The soldiers witness Nameless killing Flying Snow.We cut back to the throne room. There are strange torches between Nameless and the king that flicker in perfect unison. The king announces that he does not believe what Nameless has said. He does not believe that Broken Sword and Flying Snow were that emotionally immature. The king goes on about his suspicions. Looking paranoid, the king suspects that Nameless was working with the assassins all along. This was all a plot to put Nameless within 10 paces of the throne so he can kill the king with some awesome technique that Nameless must have. He suspects that Broken Sword and Flying Snow were willing to die for this since they tried to kill him before.In the scenes depicting the king's version of the story, everyone wears blue. Nameless presents himself to Broken Sword and Flying Snow. He displays a phenomenal technique that can kill everyone and everything within 10 paces of him, saying he used this technique to kill Sky. Nameless explains he can use this to kill the king but the only way to get close enough is to collect the reward for killing Broken Sword and Flying Snow. Nameless says he only has to kill one of them in front of the soldiers and they will believe his claim that he killed them both. Broken Sword and Flying Snow must decide which one of them will die by his sword. The next day Broken Sword and Flying Snow are walking towards the camp when Broken Sword attempts to injure Flying Snow. She is faster than him (suspecting he would try this) and she injures him instead, saying she is going to die and wants only for him to continue living. He is now too injured to stop her and so they have a tearful farewell. Flying Snow goes to the camp, fights Nameless, and dies. Nameless then shows up at a lake where Broken Sword is mourning Flying Snow. Out of honor, Broken Sword attacks Nameless; they fly over the lake as they fight. They are evenly matched, but Broken Sword stops fighting, gives Nameless his sword, and allows Nameless to leave.We cut back to the throne room as the king finishes his interpretation of what happened between Nameless, Broken Sword, and Flying Snow. The flames flicker in unison again. Nameless says your majesty is very perceptive. The king says he knew because the movement of the flames is a warning of murderous intent. The king, realizing that the man sitting 10 paces from him could kill him at any moment, asks who Nameless really is. Nameless says that he is an orphan from Zhao whose family was slaughtered by the armies of Qin. He perfected his sword technique throughout his life in order to one day avenge his family. Nameless then tells the king what really happened.We now have a flashback of the truth! In scenes with actors clothed in white, Nameless displays his technique for killing anyone within 10 paces and also shows that he can use this technique to miss every vital organ but still make the stab seem fatal; he did this to Sky. The truth is that Sky still lives! But the royal guards will think (and report) that Sky is dead. Nameless only needs to perform this move on Broken Sword and Flying Snow in public; they won't die and Nameless will have his opportunity to kill the king. Flying Snow agrees, but Broken Sword refuses.The king is shocked to hear this but it is the truth. Broken Sword does not want the king to die for reasons that he does not explain. Flying Snow attacks Broken Sword. She accuses him of ruining the opportunity they had to kill the king 3 years ago, and she won't let him ruin this plan as well. Nameless intervenes in the fight enough to distract Broken Sword so that Flying Snow can wound him. With Broken Sword wounded, Moon attacks Nameless but it is obvious that Nameless is a better fighter, so Broken Sword tells her to stop. The next day, Nameless uses his technique to apparently kill Flying Snow in front of the soldiers.The day after all that, Broken Sword confronts Nameless and confirms that Flying Snow is all right. Broken Sword gives Nameless his weapon to make it look like both Broken Sword and Flying Snow are dead so the plan will work...but he still begs Nameless not to kill the king. Nameless asks why. Broken Sword writes two words in the sand and walks away.Somewhere in all this (sorry, I don't remember where), Flying Snow arranges for a spy to watch over Nameless. She asks that this old man wave a red flag outside the palace if the assassination is successful, or a yellow one if the assassination fails. She needs to know, because her family was killed by the Qin armies as well. She believes she cannot die in peace unless she knows the king is dead.Back in the throne room, the King asks Nameless what two words Broken Sword wrote. Nameless answers our land. The king then asks how Nameless planned to kill him without a sword. Nameless answers by taking yours. The king realizes there is nothing else he can do--so he takes his sword out and throws it to Nameless. The sword stabs into the floor between them. Then the king tells Nameless about the attempt on his life 3 years ago.In the last flashback, Broken Sword and Flying Snow fight their way into the palace and kill hundreds of soldiers to get to the throne room. There, Broken Sword fights the king in the throne room while Flying Snow holds off the guards to keep anyone from helping the king. The king turns out to be quite a fighter but Broken Sword wins nonetheless. However, at this moment, Broken Sword sees something in the king's stare and decides to spare him. Flying Snow is shocked by this. They make their escape and we assume their relationship was never the same again.Back in the throne room, the archers have gathered in the doorway to kill Nameless but the king knows they cannot stop Nameless. The king stands up and turns his back to Nameless, saying he is ready to die because he realizes that Broken Sword did not kill him because Broken Sword understood the king's goal: to unite all kingdoms under heaven and end all the wars and suffering in all the lands. The king says he can die happy, knowing that someone like Broken Sword could understand his vision, and thus there is hope that others will make it happen in the future. The king stares at the scroll that Broken Sword wrote and further realizes that the ultimate ideal of swordsmanship is to have no sword.Nameless uses his deadly technique, flies through the air...and hits the king in the back with the sword's hilt. Nameless tells the king to remember this lesson: that a ruler must know when to use a sword and when to lay it down. A ruler must know that the goal of swordsmanship is to make peace. Nameless then walks out of the throne room. The guards surround Nameless every step of the way but they do not attack him.Outside the palace, the old man that Flying Snow recruited as a spy comes running out waving a yellow flag. Flying Snow turns to Broken Sword and accuses him of ruining another assassination. She demands to know what he said to Nameless. Broken Sword tells her it was just two words: our land. Flying Snow doesn't understand what this means; she attacks Broken Sword and they fight. Finally, Broken Sword invites her to attack. When she does, he deliberately drops his sword! She stabs him through the heart and cries wondering why he didn't block her. She wraps her arms around him from behind, wanting to be with her lover forever. She pushes the sword through both of them. They both die.Back at the palace, the soldiers still don't attack Nameless because they are waiting for the king's order. The king stares after Nameless with admiration, but his advisers demand that he have Nameless executed. Nameless tried to kill the king; therefore he must be made an example of so that no one else will try this and the king will be safe. The king knows they are right but he does not want to do it. The advisers shout in unison Your Majesty, execute him! several times. Nameless reaches the courtyard gates and turns around to face the king. The king silently, reluctantly gives the order and the archers launch a huge volley of arrows at Nameless, who does not try to deflect them. He is killed.A body is carried as if in a royal funeral; captions explain that the Nameless Hero was executed as an assassin but buried as an honored hero. The king of Qin eventually did conquer all the kingdoms and unite them under his rule. He went on to oversee the building of the Great Wall of China. On the closing screen, the following is written:To this day all the people of China refer to their country as...Our Land."
tt1112732,Panair do Brasil,Panair do Brasil,0,2007.0,71,Documentary,7.9,51.0,Marco Altberg,"Panair do Brasil revives the story of the most important commercial aviation company in Brazil, between 1930 and 1965, with its commercial daring in establishing routes to the four corners of a continental country, taking the adventure of air transport to never-before imagined places, as well as the first international routes. Four decades after it closed its doors, it still retains a marked presence in the country's collective imagination for its pioneering spirit and stories of heroic deeds and for the bewilderment which was aroused by the facts surrounding its closure during the military regime.

—Lu Gastão"
tt13129606,A Moment in the Sun,A Moment in the Sun,0,2020.0,70,Documentary,8.8,17.0,"Leslie Ortabasi, Oktay Ortabasi",In the early days of solar vehicle racing one of the most unlikely competitors was a Turkish nuclear physicist living in Australia named Ugur Ortabasi. He designed a four-seated solar powered tandem bicycle only a mother could love but in true underdog fashion it would go on to win the 1986 World Championships of Solar Vehicles. The story behind this unlikely victory was anything but sunshine and smooth sailing.
tt2395461,Towns,Towns,0,2012.0,59,"Comedy,Drama",9.0,13.0,Iain Cash,"A man jumps from a building to end his life, this action sets of a chain of events, with a group of Town's folk that wish to achieve their greedy aims."
tt0826237,Nadia et Sarra,Nadia et Sarra,0,2004.0,90,Drama,7.1,57.0,Moufida Tlatli,"The relationships between women: those of friends, housekeeper/servant, student/teacher, and particularly the relationship of mother and daughter as they experience the difficult stages of menopause and adolescence: 47-year-old Tunisian professor Nadia appears fulfilled, but as she enters menopause she struggles with tension in her marriage, the physical and psychological symptoms of aging, and her fraught relationship with her eighteen-year-old daughter, Sarra, who lives her private life in secret."
tt2663896,City of Photos,City of Photos,0,2004.0,59,Documentary,7.8,16.0,Nishtha Jain,"City of Photos explores the little known ethos of neighborhood photo studios in Indian cities, discovering entire imaginary worlds in the smallest of spaces. As full of surprises as the people who frequent these studios are the backdrops they enjoy posing against and the props they choose. These afford fascinating glimpses into individual fantasies and popular tastes.

—Jain, Nishtha"
tt1880331,SoLa: Louisiana Water Stories,SoLa: Louisiana Water Stories,0,2010.0,60,Documentary,7.6,15.0,Jon Bowermaster,"Everywhere you look in Southern Louisiana there's water - rivers, bayous, swamps, the Mississippi River, the Gulf of Mexico. And everyone in Cajun Country has a water story, or two or three or more. Its waterways support the biggest economies in Louisiana - a $63 billion a year oil and gas industry, a $200 million a year fishing business, tourism and recreational sports.

—Anonymous"
tt20873188,Motu Patlu in the Toy World,Motu Patlu in the Toy World,0,2021.0,\N,"Adventure,Animation,Comedy",7.0,6.0,Suhas Kadav,Motu Patlu travel to Toy world to save their friend Chaiwala and the world from the evil plans of Barbados to convert the human world into toy world.
tt8998888,The Devil's Drivers,The Devil's Drivers,0,2021.0,90,Documentary,7.6,30.0,"Mohammed Abugeth, Daniel Carsenty","Chased by the army, two Beduin smuggle Palestinian workers through the Negev desert. A portrait filmed over five years about men living on the edge in one the most fragile regions of the world."
tt2276003,The Idea Thief,The Idea Thief,0,2011.0,82,"Comedy,Drama",7.2,30.0,Jonathan R. Skocik,"Joe is an ordinary, everyday guy; a struggling writer in pursuit of his dreams. He's brimming with ideas, but there's just one problem: every time he comes up with something really fantastic, a rival author beats him to the punch. Soon Joe becomes convinced that he is the victim of plagiarism. But who is the mysterious and elusive Dean King, and how is he stealing Joe's ideas? The answers will keep you guessing -- and laughing -- right to the end!

—Anonymous"
tt0334352,Show,Show,0,2002.0,120,"Comedy,Drama",7.0,94.0,Neelakanta,"About life, its contradictions. Life is a drama and we are all actors is reflected in this film."
tt5117222,Notes on Blindness,Notes on Blindness,0,2016.0,90,"Documentary,Drama",7.0,2145.0,"James Spinney, Peter Middleton","In the summer of 1983, just days before the birth of his first son, writer and theologian John Hull went blind. In order to make sense of the upheaval in his life, he began keeping a diary on audiocassette. Upon their publication in 1990, Oliver Sacks described the work as 'the most extraordinary, precise, deep and beautiful account of blindness I have ever read. It is to my mind a masterpiece.' With exclusive access to these original recordings, NOTES ON BLINDNESS encompasses dreams, memory and imaginative life, excavating the interior world of blindness."
tt6516398,Fragile,Fragile,0,2010.0,77,Documentary,7.2,16.0,Christian Klinger,"Fragile is a film about photography in the Post Soviet Era in St. Petersburg. It looks at the bitter elegance of this town, it's citizen and the tender and graceful models of Evgeny Mokhorev."
tt10036868,Jay's Longhorn,Jay's Longhorn,0,2019.0,93,Documentary,9.0,14.0,Mark Engebretson,"Before First Avenue there was Jay's Longhorn - the epicenter of the Minneapolis punk rock and indie rock scene in the late 1970s. At a time when the music scene was dominated by Top 40 cover bands, a group of punk rock visionaries - led by Andy Schwartz, former publisher of the New York Rocker - scoured the city in search of a place that would welcome the New Wave. The Suicide Commandos, Flamingo, Curtiss A, the Suburbs, and NNB found a home at Jay's Longhorn - which also served as the launching pad for Hüsker Dü and the Replacements and the preferred venue for touring acts like Elvis Costello, The B-52s, and The Police.

—Mark Engebretson"
tt2089833,The Men of Dodge City,The Men of Dodge City,0,2012.0,94,Drama,7.1,13.0,Nandan Rao,"Twentysomething J. and two of his close friends are in the process of realizing their utopian dream: turning an abandoned cathedral into a grant-powered, environmentally sustainable art space. Newcomers to the post-industrial frontier where they found this chapel, they have been carried here by progressive beliefs that have since left them in a muddled quandary to question the validity of their presence. But there is work to do every day. Work to realize the dream they might still have.

—Anonymous"
tt5533026,Nova Planica,Nova Planica,0,2016.0,52,Documentary,8.0,6.0,Blaz Zavrsnik,The rich history of famous Slovenian ski jump and its present-day use.
tt0297213,The Rage,Furia,0,2002.0,83,"Action,Drama",7.3,1125.0,Radu Muntean,"Two young men do illegal car races. They work together as a team and prosper from their occupation ,but when they are asked by a local tycoon to lose one race things start to get messy..."
tt2513610,The Oscar Nominated Short Films 2012: Documentary,The Oscar Nominated Short Films 2012: Documentary,0,2012.0,130,Documentary,8.0,7.0,,Collective screening of the Academy Award nominated short films from the Documentary category for 2012.
tt5545674,The Constitution,Ustav Republike Hrvatske,0,2016.0,93,"Comedy,Drama",7.6,2919.0,Rajko Grlic,"A gay Croatian professor confronts his own xenophobia after agreeing to help his Serbian neighbor prepare for a citizenship exam, while the neighbor's wife cares for the professor's elderly homophobic invalid father."
tt1867616,Eternity,Tee rak,0,2011.0,105,Drama,7.0,72.0,Sivaroj Kongsakul,"The sort of love story that can only be believed in Thailand. A man returns after his death to the landscape of his youth and relives the love that was meant for eternity. Even if you don't believe in reincarnation, it's a meditative and above all beautiful film.

—Anonymous"
tt9318280,Driveways,Driveways,0,2019.0,83,Drama,7.3,5382.0,Andrew Ahn,"A lonesome boy accompanies his mother on a trip to clean out his late aunt's house, and ends up forming an unexpected friendship with the retiree who lives next door."
tt3121404,Alien Highway,Alien Highway,0,2013.0,66,"Documentary,Fantasy,History",8.2,11.0,"Robert Fowler, Roger Mexico, Michael Dale Brown","In the 1990s, rumors of recovered crashed flying saucers emerged from a phantom, top secret air base in a remote corner of Nevada's atomic test range, and the terms 'Area 51,' 'Dreamland' and 'Groom Lake' inspired hordes of UFO believers and researchers to descend on a tiny town on the border of Area 51 to trade stories, whisper secrets and watch the skies. Filmed over several years of two UFO buffs on their own personal search for the truth, 'Alien Highway' is about the people whose passionate obsession created a unique cultural phenomenon that flourished for a time in an obscure little community that happens to exist on the border of America's Twilight Zone.

—Anonymous"
tt10793838,Year of the Dog,Year of the Dog,0,2022.0,67,Documentary,9.0,10.0,Ari Davidovich,"Set during a cataclysmic year, Year of the Dog follows musician and DJ Simone Marie Butler and Dogs on the Streets, a team of volunteers working for the health and welfare of homeless people and their dogs."
